{
  "schema": "fs-output-config-1",
  "traces": {
    "_type": "TraceOutput",
    "path": "traces"
  },
  "receivers": {
    "_type": "ReceiverOutput",
    "path": "traces"
  },
  "ParaView": {
    "name": "solution",
    "path": "paraview",
    "execute_on": "solve",
    "writer": {
      "format": "vtu",
      "distribution": "root"
    },
    "target": {
      "kind": "surface",
      "mesh": {
        "upscale": 0
      }
    },
    "fields": [
      {
        "kind": "field",
        "field": "pressure",
        "name": "pressure",
        "units": "Pa"
      }
    ]
  }
}
